id,conversation_id,created_at,date,time,timezone,user_id,username,name,place,tweet,language,mentions,urls,photos,replies_count,retweets_count,likes_count,hashtags,cashtags,link,retweet,quote_url,video,thumbnail,near,geo,source,user_rt_id,user_rt,retweet_id,reply_to,retweet_date,translate,trans_src,trans_dest
1326911545419444226,1326911545419444226,2020-11-12 12:35:39 -03,2020-11-12,12:35:39,-0300,82386446,celsorussomanno,Celso Russomanno,,"Com muita alegria, recebo o apoio do @filipesabara, que fez um trabalho maravilhoso como Secretário Municipal de Assistência e Desenvolvimento Social de São Paulo.  Juntos, vamos dar continuação ao projeto de gerar mais empregos e oportunidades aqui.  Conte comigo!👊  https://t.co/8GyjDDp3AX",pt,"[{'screen_name': 'filipesabara', 'name': 'filipe sabará', 'id': '63474515'}]",[],[],110,141,633,[],[],https://twitter.com/celsorussomanno/status/1326911545419444226,False,,1,https://pbs.twimg.com/media/EmojLDBXcAY7_s_.jpg,,,,,,,[],,,,
1326902731865526280,1326902731865526280,2020-11-12 12:00:38 -03,2020-11-12,12:00:38,-0300,82386446,celsorussomanno,Celso Russomanno,,Já conhecem minhas propostas?   AGORA É A VEZ DO 1️⃣0️⃣!!!! . . . #CelsoRussomanno #CelsoRussomanno10 #AgoraÉaNossaVez #CR10 #vote10  https://t.co/cDoONYjgV2,pt,[],[],[],36,96,310,"['celsorussomanno', 'celsorussomanno10', 'agoraéanossavez', 'cr10', 'vote10']",[],https://twitter.com/celsorussomanno/status/1326902731865526280,False,,1,https://pbs.twimg.com/ext_tw_video_thumb/1326902662181376002/pu/img/dcpW1a2fg5WL-zeE.jpg,,,,,,,[],,,,
1326716626444693506,1326716626444693506,2020-11-11 23:41:07 -03,2020-11-11,23:41:07,-0300,82386446,celsorussomanno,Celso Russomanno,,"A Prefeitura estará de portas abertas para os MOTORISTAS de APLICATIVOS,  #CelsoRussomanno #CelsoRussomanno10 #AgoraÉaNossaVez #CR10 #CR10Prefeito #Vote10  https://t.co/a8JsXicE1o",pt,[],[],[],148,81,339,"['celsorussomanno', 'celsorussomanno10', 'agoraéanossavez', 'cr10', 'cr10prefeito', 'vote10']",[],https://twitter.com/celsorussomanno/status/1326716626444693506,False,,1,https://pbs.twimg.com/ext_tw_video_thumb/1326716552339656707/pu/img/uApJNFs8Kpw_Qo2G.jpg,,,,,,,[],,,,
1326714112399831040,1326714112399831040,2020-11-11 23:31:08 -03,2020-11-11,23:31:08,-0300,82386446,celsorussomanno,Celso Russomanno,,Direito de resposta.  https://t.co/Gd82DcDQ23,pt,[],[],[],645,435,2602,[],[],https://twitter.com/celsorussomanno/status/1326714112399831040,False,,1,https://pbs.twimg.com/media/Emoj_QhXEAUE7gV.jpg,,,,,,,[],,,,
1326691183381291008,1326691183381291008,2020-11-11 22:00:01 -03,2020-11-11,22:00:01,-0300,82386446,celsorussomanno,Celso Russomanno,,"A prefeitura do Bruno das Covas se mostrou eficiente em uma coisa: a gastança fúnebre.  A logística da morte, demostrada durante a pandemia, serviu apenas para espalhar o pânico entre a população, o que levou a um aumento enorme nos casos de depressão.  Não é assim que se governa  https://t.co/X7Dda36Aj9",pt,[],[],[],433,816,2544,[],[],https://twitter.com/celsorussomanno/status/1326691183381291008,False,,1,https://pbs.twimg.com/media/EmlFvN7W4AAxWHp.jpg,,,,,,,[],,,,
1326677291624243200,1326677291624243200,2020-11-11 21:04:49 -03,2020-11-11,21:04:49,-0300,82386446,celsorussomanno,Celso Russomanno,,Estou ao vivo no @tercalivre com @allanldsantos e @LorenzonItalo no #BoletimDaNoite   https://t.co/HiWPhepm5z,pt,"[{'screen_name': 'tercalivre', 'name': 'portal terça livre', 'id': '2886474167'}, {'screen_name': 'allanldsantos', 'name': 'allan dos santos', 'id': '52048790'}, {'screen_name': 'lorenzonitalo', 'name': 'italo lorenzon', 'id': '3063469756'}]",['https://www.youtube.com/watch?v=1eqSSekQDfw'],[],96,60,427,['boletimdanoite'],[],https://twitter.com/celsorussomanno/status/1326677291624243200,False,,0,,,,,,,,[],,,,
1326661474882887682,1326661474882887682,2020-11-11 20:01:58 -03,2020-11-11,20:01:58,-0300,82386446,celsorussomanno,Celso Russomanno,,"O progresso do Brasil passa pelos caminhoneiros.  Mas, em São Paulo, esse progresso foi paralisado pelos tucanos, que, com sua ganância, prejudicam esses trabalhadores.  Quem dirige o dia todo para abastecer a todos nós já sabe: a rodovia Dória e Covas leva São Paulo ao buraco!  https://t.co/9ZfWeeRnqJ",pt,[],[],[],69,240,1004,[],[],https://twitter.com/celsorussomanno/status/1326661474882887682,False,,1,https://pbs.twimg.com/media/EmlAhjKWMAEbSSa.jpg,,,,,,,[],,,,
1326606072229097478,1326606072229097478,2020-11-11 16:21:49 -03,2020-11-11,16:21:49,-0300,82386446,celsorussomanno,Celso Russomanno,,"Para zelar por São Paulo, peço seu voto!   Agora é a vez do 1⃣0⃣!!! . . . #CelsoRussomanno #CelsoRussomanno10 #AgoraÉaNossaVez #CR10 #CR10Prefeito #Vote10  https://t.co/oBskQECywl",pt,[],[],[],141,167,596,"['celsorussomanno', 'celsorussomanno10', 'agoraéanossavez', 'cr10', 'cr10prefeito', 'vote10']",[],https://twitter.com/celsorussomanno/status/1326606072229097478,False,,1,https://pbs.twimg.com/ext_tw_video_thumb/1326605998434504706/pu/img/TmZe2NOptPe1Fw-B.jpg,,,,,,,[],,,,
1326606021645754374,1326606021645754374,2020-11-11 16:21:37 -03,2020-11-11,16:21:37,-0300,82386446,celsorussomanno,Celso Russomanno,,"Ao que tudo indica, o coronavírus só é contagioso nos restaurantes, parques, bares, comércios e shoppings.   Já no comício do Bruno Dória você pode aglomerar à vontade, que o vírus não pega.   Os tucanos testaram positivo para hipocrisia.  https://t.co/Xb5tGeEy7o",pt,[],[],['https://pbs.twimg.com/media/EmkMkIpXUAMdyHg.jpg'],49,139,547,[],[],https://twitter.com/celsorussomanno/status/1326606021645754374,False,,1,https://pbs.twimg.com/media/EmkMkIpXUAMdyHg.jpg,,,,,,,[],,,,
1326586198438109185,1326586198438109185,2020-11-11 15:02:51 -03,2020-11-11,15:02:51,-0300,82386446,celsorussomanno,Celso Russomanno,,"Neste dia 15 de novembro, de que lado você vai ficar?  Do lado de quem mandou fechar o comércio, tirou seu emprego e espalhou o pânico entre a população? Ou do lado de quem ajudou você a enfrentar tudo isso?  O voto é a sua única chance de dar um basta nessa situação.  https://t.co/mx52z9rSAD",pt,[],[],[],233,592,1959,[],[],https://twitter.com/celsorussomanno/status/1326586198438109185,False,,1,https://pbs.twimg.com/ext_tw_video_thumb/1326584561761923072/pu/img/TF0X2hCLiKsnOLj3.jpg,,,,,,,[],,,,
1326570894039388162,1326570894039388162,2020-11-11 14:02:02 -03,2020-11-11,14:02:02,-0300,82386446,celsorussomanno,Celso Russomanno,,"Agradeço o apoio da minha querida amiga @simonycantora, mulher guerreira, paulistana, que conhece bem os problemas da nossa cidade.  No dia 15, aperte o 10!  Agora é a nossa vez!  https://t.co/m1169bmaMH",pt,"[{'screen_name': 'simonycantora', 'name': 'simonycantora', 'id': '51332075'}]",[],[],39,71,354,[],[],https://twitter.com/celsorussomanno/status/1326570894039388162,False,,1,https://pbs.twimg.com/ext_tw_video_thumb/1326569945426223104/pu/img/gfys-ywBC7dNLTbs.jpg,,,,,,,[],,,,
1326540350165413890,1326540350165413890,2020-11-11 12:00:40 -03,2020-11-11,12:00:40,-0300,82386446,celsorussomanno,Celso Russomanno,,"Você já foi vítima de alagamento na cidade de São Paulo e conseguiu isenção de IPTU?  O Bruno Dória diz que qualquer um pode pedir.   Mas pedir é uma coisa, conseguir a isenção é outra, né @brunocovas ?   #DebateUOLFolha  https://t.co/122GVLPU0Z",pt,"[{'screen_name': 'brunocovas', 'name': 'bruno covas', 'id': '18048666'}]",[],[],103,274,1243,['debateuolfolha'],[],https://twitter.com/celsorussomanno/status/1326540350165413890,False,,1,https://pbs.twimg.com/media/Emj7AD3XUAA-NeM.jpg,,,,,,,[],,,,
1326532738921373696,1326532738921373696,2020-11-11 11:30:25 -03,2020-11-11,11:30:25,-0300,82386446,celsorussomanno,Celso Russomanno,,"Russomanno: ""Bruno, você foi deputado comigo, e você não estava lá defendendo a cidade para evitar que a cidade perdesse arrecadação"".  #DebateUOLFolha  Acompanhe:  https://t.co/xd5IAgajZk  https://t.co/apZ9bAeQUP",pt,[],['https://youtu.be/2ly4FTkx6Lo'],[],33,95,492,['debateuolfolha'],[],https://twitter.com/celsorussomanno/status/1326532738921373696,False,,1,https://pbs.twimg.com/ext_tw_video_thumb/1326531990389092352/pu/img/27GzRJ3SKvHLo4sh.jpg,,,,,,,[],,,,
1326315422132674570,1326315422132674570,2020-11-10 21:06:53 -03,2020-11-10,21:06:53,-0300,82386446,celsorussomanno,Celso Russomanno,,"Lojas e estabelecimentos fechados. Comerciantes ameaçados. Cada vez mais gente sem trabalho.  Bruno Dória acabou com a economia de São Paulo.  Como prefeito, meu compromisso será garantir a liberdade para que empreendedores possam produzir empregos e oportunidades de crescimento.  https://t.co/2PdoO9ZJNy",pt,[],[],[],78,384,1296,[],[],https://twitter.com/celsorussomanno/status/1326315422132674570,False,,1,https://pbs.twimg.com/media/EmgFEB3WMAA4eT9.png,,,,,,,[],,,,
1326293139141910528,1326293139141910528,2020-11-10 19:38:20 -03,2020-11-10,19:38:20,-0300,82386446,celsorussomanno,Celso Russomanno,,"O Governo e a Prefeitura de São Paulo fecharam escolas, bares, restaurantes e o comércio em geral.  Com isso, deixaram muitas famílias sem trabalho e sem sustento.   Nesta eleição, você tem a chance de reagir.  Tire o emprego do Bruno Dória antes que ele tire o seu!  https://t.co/mYPTkJiMd4",pt,[],[],['https://pbs.twimg.com/media/EmfvoMwXMAE1MsN.jpg'],170,1374,4520,[],[],https://twitter.com/celsorussomanno/status/1326293139141910528,False,,1,https://pbs.twimg.com/media/EmfvoMwXMAE1MsN.jpg,,,,,,,[],,,,
1326267846406647809,1326267003942948865,2020-11-10 17:57:50 -03,2020-11-10,17:57:50,-0300,82386446,celsorussomanno,Celso Russomanno,,@BolsonaroSP AMAZING!,en,[],[],[],56,24,423,[],[],https://twitter.com/celsorussomanno/status/1326267846406647809,False,,0,,,,,,,,"[{'screen_name': 'BolsonaroSP', 'name': 'Eduardo Bolsonaro🇧🇷', 'id': '74756085'}]",,,,
1326247201119547395,1326244743345475585,2020-11-10 16:35:47 -03,2020-11-10,16:35:47,-0300,82386446,celsorussomanno,Celso Russomanno,,"@kimpkat @TIMBrasil Eu já tenho um plano de telefone ótimo:  É só encostar na tela do celular e PIMBA!   Diferente do seu, que só recebe chamada da prisão e não completa a ligação do seu amigo Luciano, que gosta de passear em Mônaco.  Abraço!",pt,[],[],[],157,182,1428,[],[],https://twitter.com/celsorussomanno/status/1326247201119547395,False,,0,,,,,,,,"[{'screen_name': 'kimpkat', 'name': 'Kim Kataguiri 🇧🇷', 'id': '1494658207'}, {'screen_name': 'TIMBrasil', 'name': 'TIM Brasil', 'id': '62572858'}]",,,,
1326207452849827840,1326207452849827840,2020-11-10 13:57:51 -03,2020-11-10,13:57:51,-0300,82386446,celsorussomanno,Celso Russomanno,,"Cuidar das pessoas exige tempo. Exige conversa. Exige correr atrás, às vezes cruzar a cidade toda para buscar uma solução.  O @arthurmoledoval não sabe disso, porque não costuma fazer nem o básico, que é estar presente na Assembleia Legislativa, onde é conhecido como #MamaeFaltei  https://t.co/5VFyQVkx7u",pt,"[{'screen_name': 'arthurmoledoval', 'name': 'arthur do val - mamaefalei', 'id': '4106068103'}]",[],[],941,1703,10860,['mamaefaltei'],[],https://twitter.com/celsorussomanno/status/1326207452849827840,False,,1,https://pbs.twimg.com/ext_tw_video_thumb/1326207081389682693/pu/img/mfxEJ7dcXHpcn5lv.jpg,,,,,,,[],,,,
1326177527312883714,1326177527312883714,2020-11-10 11:58:56 -03,2020-11-10,11:58:56,-0300,82386446,celsorussomanno,Celso Russomanno,,"Russomanno: ""Boulos promove invasão de residências, prédios, áreas públicas, não tem consideração nenhuma com as pessoas, já foi preso por causa disso. É assim que você vai governar?"" #DebateEstadao  Acompanhe:  https://t.co/iBwjPI9Met  https://t.co/X745PP8C6h",pt,[],['https://youtu.be/2bcnMfarhj4'],['https://pbs.twimg.com/media/EmeGw_VXEAAa8yR.png'],211,510,2594,['debateestadao'],[],https://twitter.com/celsorussomanno/status/1326177527312883714,False,,1,https://pbs.twimg.com/media/EmeGw_VXEAAa8yR.png,,,,,,,[],,,,
1326160774465789963,1326160774465789963,2020-11-10 10:52:22 -03,2020-11-10,10:52:22,-0300,82386446,celsorussomanno,Celso Russomanno,,"Cuidado com a ditadura que querem nos impor com a vacina da COVID-19.   Estamos falando de uma vacina EXPERIMENTAL, e todos nós corremos o risco de sermos cobaias.   Isso é um desrespeito com a vida dos paulistanos, e não podemos aceitar que siga adiante!  https://t.co/7e0gPHmn24",pt,[],[],[],74,147,496,[],[],https://twitter.com/celsorussomanno/status/1326160774465789963,False,,1,https://pbs.twimg.com/ext_tw_video_thumb/1326157535884283904/pu/img/U9YZ9Kye90ddvXZ7.jpg,,,,,,,[],,,,
1325990047083094024,1325990037712998402,2020-11-09 23:33:57 -03,2020-11-09,23:33:57,-0300,82386446,celsorussomanno,Celso Russomanno,,"Como eu havia dito em evento na Associação Paulista de Imprensa - API, sem testes duplo-cegos em uma ampla base de pacientes, seria criminoso determinar a disponibilidade da vacina para toda a população.   CELSO RUSSOMANNO. [4/4]",pt,[],[],[],43,181,1139,[],[],https://twitter.com/celsorussomanno/status/1325990047083094024,False,,0,,,,,,,,[],,,,
1325990044600070144,1325990037712998402,2020-11-09 23:33:56 -03,2020-11-09,23:33:56,-0300,82386446,celsorussomanno,Celso Russomanno,,"Mais uma vez, o governo Dória assume um risco desnecessário e apressado, desta vez contra a saúde do povo brasileiro, com o objetivo rasteiro de obter lucro político. [3/4]",pt,[],[],[],23,228,1309,[],[],https://twitter.com/celsorussomanno/status/1325990044600070144,False,,0,,,,,,,,[],,,,
1325990039948505090,1325990037712998402,2020-11-09 23:33:55 -03,2020-11-09,23:33:55,-0300,82386446,celsorussomanno,Celso Russomanno,,"O Governo Federal, por meio da ANVISA, suspendeu acertadamente o ensaio clínico da CORONAVAC, uma  vacina que ESTÁ LONGE DE CUMPRIR AS ETAPAS OBRIGATÓRIAS PARA SUA APROVAÇÃO. [2/4]",pt,[],[],[],24,219,1220,[],[],https://twitter.com/celsorussomanno/status/1325990039948505090,False,,0,,,,,,,,[],,,,
1325990037712998402,1325990037712998402,2020-11-09 23:33:55 -03,2020-11-09,23:33:55,-0300,82386446,celsorussomanno,Celso Russomanno,,"NOTA AO POVO PAULISTANO E À IMPRENSA  Como prefeito de São Paulo, protegerei nossa população deste estelionato tucano.  Não os decepcionarei! [1/4]  https://t.co/Xp1Xr8yzyb",pt,[],[],['https://pbs.twimg.com/media/EmbcXUAXMAAIhLI.png'],353,1045,4880,[],[],https://twitter.com/celsorussomanno/status/1325990037712998402,False,,1,https://pbs.twimg.com/media/EmbcXUAXMAAIhLI.png,,,,,,,[],,,,
1325933790997385222,1325933790997385222,2020-11-09 19:50:25 -03,2020-11-09,19:50:25,-0300,82386446,celsorussomanno,Celso Russomanno,,A Direita Conservadora paulistana está definitivamente alinhada!  São Paulo acima de tudo Deus acima de todos  @CastelloSP @carteiroreaca @DouglasGarcia @MajorMecca @DAVILAFREDERICO @andrepetros   @Steh_Papaiano @Rodrigoneves77 @caiquemafra38  https://t.co/yrM4W6so5p,pt,"[{'screen_name': 'castellosp', 'name': 'deputado castello branco', 'id': '1000450601615024128'}, {'screen_name': 'carteiroreaca', 'name': 'gil diniz', 'id': '2797010717'}, {'screen_name': 'douglasgarcia', 'name': 'douglas garcia', 'id': '1040704983358955526'}, {'screen_name': 'majormecca', 'name': 'major mecca', 'id': '931022287066804224'}, {'screen_name': 'davilafrederico', 'name': ""frederico d'avila"", 'id': '74944989'}, {'screen_name': 'andrepetros', 'name': 'andré petros', 'id': '770641041670234116'}, {'screen_name': 'steh_papaiano', 'name': 'steh papaiano 🦝', 'id': '1264592571122278409'}, {'screen_name': 'rodrigoneves77', 'name': 'rodrigo neves', 'id': '3411264071'}, {'screen_name': 'caiquemafra38', 'name': 'caíque mafra 🇧🇷', 'id': '52888513'}]",[],"['https://pbs.twimg.com/media/EmalrpaXcAQNFsg.jpg', 'https://pbs.twimg.com/media/EmalrpcXYAQpWOI.jpg']",422,429,2111,[],[],https://twitter.com/celsorussomanno/status/1325933790997385222,False,,1,https://pbs.twimg.com/media/EmalrpaXcAQNFsg.jpg,,,,,,,[],,,,
1325845977018806274,1325845977018806274,2020-11-09 14:01:28 -03,2020-11-09,14:01:28,-0300,82386446,celsorussomanno,Celso Russomanno,,Confie em quem dedicou toda a vida lutando pelos direitos das pessoas. Confie em mim! . . . . . #CelsoRussomanno #CelsoRussomanno10 #AgoraÉaNossaVez #CR10 #CR10Prefeito #VoteCR10 ⠀  https://t.co/wkhxU2tu79,pt,[],[],[],31,43,221,"['celsorussomanno', 'celsorussomanno10', 'agoraéanossavez', 'cr10', 'cr10prefeito', 'votecr10']",[],https://twitter.com/celsorussomanno/status/1325845977018806274,False,,1,https://pbs.twimg.com/ext_tw_video_thumb/1325845905191428099/pu/img/2yCNRZDcSwToGfmh.jpg,,,,,,,[],,,,
1325815940387385344,1325815940387385344,2020-11-09 12:02:07 -03,2020-11-09,12:02:07,-0300,82386446,celsorussomanno,Celso Russomanno,,"É 10! É 10! É 10!  Carreata pela zona Sul da cidade de São Paulo.  Obrigado pela recepção maravilhosa.    Agora, é a nossa vez!! . . . . #CelsoRussomanno #CelsoRussomanno10 #AgoraÉaNossaVez #CR10 #CR10Prefeito #VoteCR10 ⠀  https://t.co/0kstOhMiHS",pt,[],[],"['https://pbs.twimg.com/media/EmY-kg0WEAAhGaW.jpg', 'https://pbs.twimg.com/media/EmY-kf-W4AEIBW-.jpg', 'https://pbs.twimg.com/media/EmY-kg3XMAMnxCI.jpg', 'https://pbs.twimg.com/media/EmY-kgUW8AI8mFI.jpg']",19,40,214,"['celsorussomanno', 'celsorussomanno10', 'agoraéanossavez', 'cr10', 'cr10prefeito', 'votecr10']",[],https://twitter.com/celsorussomanno/status/1325815940387385344,False,,1,https://pbs.twimg.com/media/EmY-kg0WEAAhGaW.jpg,,,,,,,[],,,,
1325811052240625664,1325811052240625664,2020-11-09 11:42:41 -03,2020-11-09,11:42:41,-0300,82386446,celsorussomanno,Celso Russomanno,,Trecho da live de ontem com a @tamires_scpaula em que desminto acusações de racismo contra mim em polêmica sobre semáforos e punho cerrado:  https://t.co/POdRd4WK3y,pt,"[{'screen_name': 'tamires_scpaula', 'name': 'tamires de paula', 'id': '985634417799585792'}]",[],[],27,65,323,[],[],https://twitter.com/celsorussomanno/status/1325811052240625664,False,,1,https://pbs.twimg.com/ext_tw_video_thumb/1325810314714226688/pu/img/BK20JmnIRJXrDIoZ.jpg,,,,,,,[],,,,
1325793533987532800,1325793533987532800,2020-11-09 10:33:05 -03,2020-11-09,10:33:05,-0300,82386446,celsorussomanno,Celso Russomanno,,"Se você quer que São Paulo volte a ter uma vida normal, de trabalho e de produção, não vote em quem atua para impedir isso.   Quem soldou portas, fechou negócios e acabou com empregos já tem planos para repetir a dose.  Só você pode evitar isso, como avisa a @taoquei1.  https://t.co/dASYqMZEDv",pt,"[{'screen_name': 'taoquei1', 'name': 'teatualizei 🇧🇷👊🏻❤️', 'id': '1087259768'}]",[],[],66,365,1183,[],[],https://twitter.com/celsorussomanno/status/1325793533987532800,False,,1,https://pbs.twimg.com/ext_tw_video_thumb/1325793096957915137/pu/img/jcD55sCFGrpO5MOl.jpg,,,,,,,[],,,,
1325606066961330178,1325606066961330178,2020-11-08 22:08:09 -03,2020-11-08,22:08:09,-0300,82386446,celsorussomanno,Celso Russomanno,,"O @sikerajr está coberto de razão!  Os mesmos políticos que fecharam tudo e tiraram seu emprego agora se passam por bonzinhos e tentam enganar o povo mais uma vez.  Se forem reeleitos, irão trazer ainda mais desemprego e perda de liberdades.  Só você pode mudar isso!  https://t.co/XCI8obY7kI",pt,"[{'screen_name': 'sikerajr', 'name': 'sikêra júnior', 'id': '260509524'}]",[],[],58,242,889,[],[],https://twitter.com/celsorussomanno/status/1325606066961330178,False,,1,https://pbs.twimg.com/ext_tw_video_thumb/1325605799713009665/pu/img/WLobnmnDJ2RmxDti.jpg,,,,,,,[],,,,
1325529342953353219,1325529342953353219,2020-11-08 17:03:17 -03,2020-11-08,17:03:17,-0300,82386446,celsorussomanno,Celso Russomanno,,"Mais de 360 MIL pessoas atendidas em 30 anos de luta pelo Direito do Consumidor, seus direitos.   #CelsoRussomanno #CelsoRussomanno10 #AgoraÉaNossaVez #CR10 #CR10Prefeito #VoteCR10  https://t.co/sYPLGH3qJi",pt,[],[],[],15,24,137,"['celsorussomanno', 'celsorussomanno10', 'agoraéanossavez', 'cr10', 'cr10prefeito', 'votecr10']",[],https://twitter.com/celsorussomanno/status/1325529342953353219,False,,1,https://pbs.twimg.com/ext_tw_video_thumb/1325529280323969027/pu/img/ZYbibF_fF_NCwiSa.jpg,,,,,,,[],,,,
1325508189442486273,1325508189442486273,2020-11-08 15:39:13 -03,2020-11-08,15:39:13,-0300,82386446,celsorussomanno,Celso Russomanno,,"A mesma coragem que levou milhões de pessoas às ruas para mudar o Brasil também pode transformar a cidade de São Paulo  Já vimos o que governos de esquerda, que desprezam a liberdade, a família e o direito à propriedade, são capazes de fazer  Contem comigo para pôr um fim nisso!  https://t.co/J54EqQgXV3",pt,[],[],[],58,203,827,[],[],https://twitter.com/celsorussomanno/status/1325508189442486273,False,,1,https://pbs.twimg.com/ext_tw_video_thumb/1325507584900673539/pu/img/csyNL-_qDPMkdc2Z.jpg,,,,,,,[],,,,
1325429906042400768,1325429906042400768,2020-11-08 10:28:09 -03,2020-11-08,10:28:09,-0300,82386446,celsorussomanno,Celso Russomanno,,"Hoje , às 16h, estarei ao vivo para o Facebook e o canal do YouTube da jornalista, Liliane Ventura.  Acompanhem!! ⠀ Conto com a presença 10 de vocês!!!  #CelsoRussomanno10 #AgoraÉaNossaVez #CR10Prefeito  https://t.co/hsESpYtKU7",pt,[],[],[],23,31,142,"['celsorussomanno10', 'agoraéanossavez', 'cr10prefeito']",[],https://twitter.com/celsorussomanno/status/1325429906042400768,False,,1,https://pbs.twimg.com/ext_tw_video_thumb/1325429878024441857/pu/img/TXoR0F--HW0rnKjE.jpg,,,,,,,[],,,,
1325300077326438400,1325300077326438400,2020-11-08 01:52:15 -03,2020-11-08,01:52:15,-0300,82386446,celsorussomanno,Celso Russomanno,,Ronda Guardiã Maria da Penha.  Agora é a vez do 1⃣0⃣!  #CelsoRussomanno10 #AgoraÉaNossaVez #CR10 #CR10Prefeito #Vote10  https://t.co/4MzebBnKsG,pt,[],[],[],17,28,126,"['celsorussomanno10', 'agoraéanossavez', 'cr10', 'cr10prefeito', 'vote10']",[],https://twitter.com/celsorussomanno/status/1325300077326438400,False,,1,https://pbs.twimg.com/ext_tw_video_thumb/1325300033709858823/pu/img/oprlmftt2TnDCZus.jpg,,,,,,,[],,,,
1325298729675599872,1325298729675599872,2020-11-08 01:46:54 -03,2020-11-08,01:46:54,-0300,82386446,celsorussomanno,Celso Russomanno,,Atacar a honra de seus adversários é comum para Boulos  Agora é a vez do 1⃣0⃣!  #CelsoRussomanno10 #AgoraÉaNossaVez #CR10 #CR10Prefeito #Vote10  https://t.co/XO1fhHmoFj,pt,[],[],['https://pbs.twimg.com/media/EmRoK9yXUAEUI6f.jpg'],26,28,126,"['celsorussomanno10', 'agoraéanossavez', 'cr10', 'cr10prefeito', 'vote10']",[],https://twitter.com/celsorussomanno/status/1325298729675599872,False,,1,https://pbs.twimg.com/media/EmRoK9yXUAEUI6f.jpg,,,,,,,[],,,,
1325296853370499077,1325296853370499077,2020-11-08 01:39:27 -03,2020-11-08,01:39:27,-0300,82386446,celsorussomanno,Celso Russomanno,,"Apaixonado pelo seu país e principalmente por SÃO PAULO, comprometido em melhorar a qualidade de vida e infraestrutura da cidade. Pode confiar! Vamos juntos nos próximos quatro anos fazer diferente, nossa cidade precisa!  #CR10 #CR10Prefeito #Vote10  https://t.co/fFUkZjFLtd",pt,[],[],['https://pbs.twimg.com/media/EmRmaFpXYAA5Qkk.jpg'],197,302,1923,"['cr10', 'cr10prefeito', 'vote10']",[],https://twitter.com/celsorussomanno/status/1325296853370499077,False,,1,https://pbs.twimg.com/media/EmRmaFpXYAA5Qkk.jpg,,,,,,,[],,,,
1325235399594291202,1325235399594291202,2020-11-07 21:35:15 -03,2020-11-07,21:35:15,-0300,82386446,celsorussomanno,Celso Russomanno,,"Na minha participação no @CanaldoNegaoo , eu falo sobre as fake news de que eu era contra o auxílio emergencial.   Também falo um pouco da queda na arrecadação da cidade causada pelo prefeito Bruno Dória.  https://t.co/pAWmiRLfla",pt,"[{'screen_name': 'canaldonegaoo', 'name': 'canal do negão', 'id': '69729360'}]",[],[],23,54,278,[],[],https://twitter.com/celsorussomanno/status/1325235399594291202,False,,1,https://pbs.twimg.com/ext_tw_video_thumb/1325234140522930176/pu/img/Dx0_7Jb81UcH9o2W.jpg,,,,,,,[],,,,
1325187693106507777,1325187693106507777,2020-11-07 18:25:41 -03,2020-11-07,18:25:41,-0300,82386446,celsorussomanno,Celso Russomanno,,"Nossa passeata, pelo JAGUARÈ na cidade de São Paulo. ⠀ Agora é a vez do 10!!! ⠀ #CelsoRussomanno #CelsoRussomanno10 #AgoraÉaNossaVez #CR10 #CR10Prefeito #VoteCR10  https://t.co/VNmWaDScbW",pt,[],[],[],16,34,190,"['celsorussomanno', 'celsorussomanno10', 'agoraéanossavez', 'cr10', 'cr10prefeito', 'votecr10']",[],https://twitter.com/celsorussomanno/status/1325187693106507777,False,,1,https://pbs.twimg.com/ext_tw_video_thumb/1325187367968403457/pu/img/vFqbP7_PQHY80N_I.jpg,,,,,,,[],,,,
1325091610863013890,1325091610863013890,2020-11-07 12:03:53 -03,2020-11-07,12:03:53,-0300,82386446,celsorussomanno,Celso Russomanno,,"Hoje , às 20h, estarei ao vivo para o Movimento República de Curitiba em uma LIVE para o Facebook.  Acompanhem no Facebook da República de Curitiba.  Conto com a presença 10 de vocês!!! . . #CelsoRussomanno #CelsoRussomanno10 #AgoraÉaNossaVez #CR10 #CR10Prefeito #vote10  https://t.co/D83DL6TBvP",pt,[],[],[],28,31,134,"['celsorussomanno', 'celsorussomanno10', 'agoraéanossavez', 'cr10', 'cr10prefeito', 'vote10']",[],https://twitter.com/celsorussomanno/status/1325091610863013890,False,,1,https://pbs.twimg.com/media/EmOtof4XIAErRs1.jpg,,,,,,,[],,,,
1324901118116327424,1324901118116327424,2020-11-06 23:26:56 -03,2020-11-06,23:26:56,-0300,82386446,celsorussomanno,Celso Russomanno,,"Recentemente, houve a tentativa de criar uma polêmica em torno de uma declaração minha.  Trata-se de uma tática velha e desgastada da militância esquerdista para tentar desqualificar seus adversários.  Publico minha resposta aqui, porque sei que a imprensa irá ignorá-la.  https://t.co/quFUzS8JRp",pt,[],[],"['https://pbs.twimg.com/media/EmL-GejXEAAAQ_V.jpg', 'https://pbs.twimg.com/media/EmL-Mq9XEAUM7oT.jpg', 'https://pbs.twimg.com/media/EmL-TlYXEAEl0bj.jpg', 'https://pbs.twimg.com/media/EmL-Y5XW8AEruPr.jpg']",102,244,1373,[],[],https://twitter.com/celsorussomanno/status/1324901118116327424,False,,1,https://pbs.twimg.com/media/EmL-GejXEAAAQ_V.jpg,,,,,,,[],,,,
